{
  "$schema": "https://json-schema.org/draft/2020-12/schema",
  "$id": "https://sergioanastacio.github.io/AssessmentPlatform/schemas/problem.schema.json",
  "title": "Assessment Problem",
  "type": "object",
  "required": ["id", "title", "difficulty", "statement", "function", "tests"],
  "properties": {
    "id": { "type": "string", "minLength": 1 },
    "title": { "type": "string", "minLength": 1 },
    "difficulty": { "enum": ["easy", "medium", "hard"] },
    "statement": { "type": "string", "minLength": 1 },
    "function": {
      "type": "object",
      "required": ["name", "params", "returns"],
      "properties": {
        "name": { "type": "string", "minLength": 1 },
        "params": {
          "type": "array",
          "items": {
            "type": "object",
            "required": ["name", "type"],
            "properties": {
              "name": { "type": "string", "minLength": 1 },
              "type": { "type": "string", "minLength": 1 }
            },
            "additionalProperties": true
          }
        },
        "returns": {
          "type": "object",
          "required": ["type"],
          "properties": {
            "type": { "type": "string", "minLength": 1 }
          },
          "additionalProperties": true
        }
      },
      "additionalProperties": true
    },
    "examples": {
      "type": "array",
      "items": {
        "type": "object",
        "required": ["input", "output"],
        "properties": {
          "input": { "type": "array" },
          "output": {}
        },
        "additionalProperties": true
      }
    },
    "tests": {
      "type": "array",
      "minItems": 1,
      "items": {
        "type": "object",
        "required": ["input", "output"],
        "properties": {
          "input": { "type": "array" },
          "output": {}
        },
        "additionalProperties": true
      }
    },
    "constraints": {
      "type": "object",
      "properties": {
        "time_limit_ms": { "type": "integer", "minimum": 1 },
        "memory_limit_mb": { "type": "integer", "minimum": 1 }
      },
      "additionalProperties": true
    }
  },
  "additionalProperties": true
}
